{
  "schema_version": 2,
  "integration": "HolobikeExperience",
  "domain": "ue",
  "repository": "HolobikeExperience_uproject",
  "origin": "git@github.com:Saga-Holographic/HolobikeExperience_uproject.git",
  "unreal_project": "HolobikeExperience/HolobikeExperience.uproject",
  "deployables": {
    "HolobikeExperience": {
      "destination": "device"
    }
  }
}
