{
  "schema_version": 2,
  "integration": "HexAtlas",
  "domain": "geo",
  "repository": "HexAtlas",
  "deployables": {
    "AtlasClient": {
      "destination": "device"
    },
    "AtlasServer": {
      "destination": "server"
    },
    "AtlasCartographer": {
      "destination": "server"
    }
  }
}
