{
  "schema_version": 2,
  "integration": "AthleteIdentity",
  "domain": "id",
  "repository": "AthleteIdentity",
  "origin": "git@github.com:Saga-Holographic/AthleteIdentity.git",
  "deployables": {
    "IdentityClient": {
      "destination": "device",
      "build": {
        "steps": [
          {
            "argv": [
              "./IdentityClient/identityclient.sh",
              "build"
            ]
          }
        ]
      },
      "artifacts": [
        "Builds/AthleteIdentityClient_linux/bin/athleteidentity_service",
        "Builds/AthleteIdentityClient_linux/bin/athleteidentity_cli"
      ],
      "serve": {
        "argv": [
          "${BUNDLE}/athleteidentity_service",
          "--profiles-root",
          "${STATE}/profiles",
          "--provider-root",
          "${STATE}/provider",
          "--endpoint",
          "./athleteidentity.sock"
        ],
        "env": {
          "ATHLETE_IDENTITY_KEY_PROVIDER": "filesystem"
        }
      },
      "probe": {
        "argv": [
          "${BUNDLE}/athleteidentity_cli",
          "service",
          "probe",
          "--endpoint",
          "./athleteidentity.sock"
        ]
      }
    },
    "IdentityServer": {
      "destination": "server",
      "build": {
        "steps": [
          {
            "argv": [
              "docker",
              "build",
              "-f",
              "IdentityServer/Deployment/Dockerfile",
              "-t",
              "athleteidentity-server:base",
              "."
            ]
          },
          {
            "argv": [
              "docker",
              "save",
              "-o",
              "Builds/athleteidentity-server-base.tar",
              "athleteidentity-server:base"
            ]
          }
        ]
      },
      "artifacts": [
        "Builds/athleteidentity-server-base.tar"
      ]
    }
  }
}
