{
  "schema_version": 2,
  "integration": "HexAtlas",
  "domain": "geo",
  "repository": "HexAtlas",
  "deployables": {
    "AtlasClient": {
      "destination": "device",
      "build": {
        "steps": [
          {
            "argv": [
              "cmake",
              "--build",
              "Builds"
            ]
          }
        ]
      },
      "artifacts": [
        "Builds/bin/atlas_service"
      ]
    }
  }
}
